{"$id":"provan.owner_decision.v1","$schema":"https://json-schema.org/draft/2020-12/schema","additionalProperties":false,"properties":{"accepted_risks":{"type":"array"},"actor":{"type":"object"},"attestation_ref":{"additionalProperties":false,"properties":{"id":{"minLength":1,"type":"string"},"sha256":{"pattern":"^sha256:[0-9a-f]{64}$","type":"string"}},"required":["id","sha256"],"type":"object"},"conditions":{"type":"array"},"created_at":{"format":"date-time","type":"string"},"decision":{"enum":["accept","accept_with_conditions","hold","reject","override_accept_risk"]},"decision_id":{"format":"uuid","type":"string"},"expires_at":{"type":["string","null"]},"provan_recommendation":{"enum":["cleared","held","not_eligible"]},"rationale":{"type":["string","null"]},"required_reinspection":{"type":"array"},"schema_id":{"const":"provan.owner_decision.v1"}},"required":["schema_id","decision_id","attestation_ref","provan_recommendation","decision","actor","rationale","accepted_risks","conditions","expires_at","required_reinspection","created_at"],"type":"object"}
