{"accepted_risks":[],"actor":{"actor_label":"session11-case-operator","authority_type":"case_operator","identity_assurance":"self_asserted_label"},"attestation_ref":{"id":"368c1ffe-96fb-4bf6-9a26-d642e1db1e6b","sha256":"sha256:62d73692f8855c40d678935862feb68a652b2fce9c4951e24c351ef3acf926f8"},"conditions":[],"created_at":"2026-08-10T12:00:00Z","decision":"hold","decision_id":"6f04815e-a33b-4244-90df-cadde6e5922c","expires_at":null,"provan_recommendation":"held","rationale":"Risk and reversibility remain unresolved.","required_reinspection":[],"schema_id":"provan.owner_decision.v1"}
