{"accepted_risks":[],"actor":{"actor_label":"case-operator-without-upstream-owner-authority","authority_type":"case_operator","identity_assurance":"self_asserted_label"},"attestation_ref":{"id":"0e6191dc-f09e-4413-b648-37afbd6d9423","sha256":"sha256:d78595d4e2625eba5ae11ca1a8db99adb2d1135ad0eea02252f60ff2872205ba"},"conditions":[],"created_at":"2026-08-12T00:00:00Z","decision":"hold","decision_id":"e7a07b89-271e-4c56-951f-010fe612959e","expires_at":null,"provan_recommendation":"held","rationale":"No authentic upstream owner authority was obtained.","required_reinspection":[],"schema_id":"provan.owner_decision.v1"}
